{"type":"config","name":"PiTuned startup + agent-loop optimizations","metricName":"total_extension_load_ms","metricUnit":"ms","bestDirection":"lower"}
{"run":1,"commit":"5e2b60f","metric":3869,"metrics":{"avg_wall_ms":5687,"extension_count":21},"status":"keep","description":"baseline: pit --help, sum of per-extension load ms, best of 3","timestamp":1779252905000,"segment":0,"confidence":null,"asi":{"hypothesis":"baseline pre-optimization","ext_count":21,"wall_avg_ms":5687}}
{"run":2,"commit":"442d42c","metric":2809,"metrics":{"avg_wall_ms":4563,"extension_count":21},"status":"keep","description":"precompile walk all .ts deps + package-manager swap manifest .ts->.js for file entries","timestamp":1779253314321,"segment":0,"confidence":null,"asi":{"hypothesis":"precompile incomplete + manifest file entries skipped .js swap. fix both","wins":["pi-rtk-optimizer 308->21ms","pi-web-access 450->173ms","rpiv-ask-user-question 567->31ms","rpiv-todo 335->17ms","agent-browser 180->19ms"],"regressions":["pi-subagents 90->464ms native ESM many-file overhead","@tintinweb/pi-tasks 50->357ms similar"],"wall_delta_pct":-20,"ext_load_delta_pct":-27}}
{"run":3,"commit":"fd717f1","metric":2889,"metrics":{"avg_wall_ms":4559,"extension_count":21},"status":"keep","description":"agent-loop: single filter pass + sequential short-circuit + Set in-place mutation","timestamp":1779253474115,"segment":0,"confidence":13.25,"asi":{"hypothesis":"agent-loop micro-opts: drop redundant filter, skip toolMap probe when forceSequential, mutate pendingToolCalls Set in place","tool_bench_fanout_per_call_ms":0.018,"tool_bench_turns_per_turn_ms":0.038,"tests_passed":35,"note":"ext_load wall same as prior; agent-loop work invisible to startup bench but visible in tool batches"}}
{"run":4,"commit":"fd717f1","metric":2883,"metrics":{"avg_wall_ms":4580,"extension_count":21},"status":"discard","description":"enable prewarmExtensionLoader at main start","timestamp":1779253576419,"segment":0,"confidence":26.5,"asi":{"hypothesis":"overlap jiti core lib transpile with parseArgs/migrations","rollback_reason":"no measurable wall improvement (4580 vs 4559), within noise. confirms existing comment that prewarm cost equals first .ts extension cost on single-threaded jiti","next_action_hint":"leave prewarm exported for SDK callers, do not auto-trigger"}}
{"type":"config","name":"PiTuned reasoning/call execution speed (prompt prefix size + config)","metricName":"prompt_prefix_tokens","metricUnit":"","bestDirection":"lower"}
{"run":5,"commit":"working","metric":2645,"metrics":{"avg_wall_ms":4234,"extension_count":21},"status":"keep","description":"runner: emitContext skip clone+early-out + cache getAllRegisteredTools/getFlags/getRegisteredCommands/getCommand (Map lookup O(1))","timestamp":1779260800000,"segment":0,"confidence":null,"asi":{"hypothesis":"unconditional structuredClone every turn (transformContext path) + per-call getter recomputation in TUI render loops. fix: hasHandlers context early-out, drop clone (handler contract: no in-place mutation), memoize getters invalidated by wrapped refreshTools","wins":["ext_load 2889->2645 (-8%)","wall 4559->4234 (-7%)","emit_context structuredClone of 25k-token transcript eliminated","getCommand O(N) find -> O(1) Map lookup"],"tests":"65/65 coding-agent runner+discovery+suite, 155/167 agent harness (12 pre-existing windows fails)"}}
{"run":6,"commit":"working","metric":2744,"metrics":{"avg_wall_ms":4321,"extension_count":21},"status":"keep","description":"runner: split before_provider_request (side-effect parallel / mutating serial via pi.markSideEffect) + PI_TIMING instrumentation emit_context_ms + emit_bpr_ms","timestamp":1779261200000,"segment":0,"confidence":null,"asi":{"hypothesis":"21 extensions; only pi-claude-oauth-adapter mutates payload (grep confirmed). split lets side-effect hooks (logs, telemetry, OAuth-watch) run in Promise.all instead of serial. instrument both emitContext and emitBeforeProviderRequest with PI_TIMING=1 logging so per-turn ground truth is measurable","api_change":"pi.markSideEffect(handler) — opt-in tagging; default mutating preserves prior semantics","metrics_emitted":["METRIC emit_context_ms","METRIC emit_bpr_ms"],"startup_delta":"within noise vs run 5 (2645 -> 2744); split only fires per-turn so startup bench cannot observe gain","next":"run pit -p with PI_TIMING=1 on real turn, capture METRIC emit_bpr_ms before/after extensions opt into markSideEffect"}}
{"run":7,"commit":"working","metric":2713,"metrics":{"avg_wall_ms":4271,"extension_count":21},"status":"keep","description":"runner: emit() parallel for side-effect events (turn_start/turn_end/session_start/agent_start/etc) + PI_SIDE_EFFECT_EXTENSIONS env-driven before_provider_request tagging in loader","timestamp":1779261800000,"segment":0,"confidence":null,"asi":{"hypothesis":"installed extension survey: 98 session_start, 41 session_shutdown, 39 before_agent_start, 27 agent_end, 21 tool_call, 17 turn_start/turn_end, 9 tool_result, 8 context, 5 before_provider_request, 5 after_provider_response — only session_before_* needs serial (cancel short-circuit). Rest are side-effect; parallelize emit() to settle all handlers in one event-loop tick","invariants":{"session_before_serial":"preserves cancel short-circuit","emit_error_isolation":"one handler throw does not abort siblings"},"tests":"32/32 runner (3 new: bpr split, env-marking, emit parallel + session_before serial)","env_var":"PI_SIDE_EFFECT_EXTENSIONS=<substr1>,<substr2> tags 3rd-party before_provider_request handlers as parallel without patching extension source","real_world_users":{"before_provider_request_mutating":["pi-claude-oauth-adapter"],"before_provider_request_total":1},"bench_delta":"wall 4559(run1) -> 4271 (-6%); ext_load 2889->2713 (-6%); per-turn gain only visible with PI_TIMING=1 on real pit -p"}}
{"run":8,"commit":"working","metric":2701,"metrics":{"avg_wall_ms":4307,"extension_count":21},"status":"keep","description":"simplify: HANDLER_SIDE_EFFECT_TAG const (kill magic string x3), emit() hasHandlers gate, cache bpr partition, getCommand calls getRegisteredCommands, dedup bpr try/catch via runHandler, strip narrative comments","timestamp":1779262400000,"segment":0,"confidence":null,"asi":{"fixed":["string-tag-x3 -> exported const HANDLER_SIDE_EFFECT_TAG","emit() 0-handler hot path: hasHandlers gate before partition alloc","bpr partition cached in _cachedBprPartition (re-alloc -> O(1) re-read per turn)","getCommand bypassed getRegisteredCommands -> commandDiagnostics stale, fixed","emitBeforeProviderRequest 2 try/catch -> 1 runHandler helper","stripped: '(CHANGED from upstream)', '5-20ms on 25k-token sessions', '@capyup/pi-goal inspected', '21 extensions in ~/.pi/agent/npm', 'Default-mutating preserves existing semantics'"],"skipped":["Symbol vs string property (style call, const is enough)","parseCommaList util (touches cli/args.ts -> scope creep)","iterHandlers generator (pre-existing 12 sites)","logPerfMetric helper (2 callsites, different shapes)","split refreshTools/commands invalidation (negligible)"],"tests":"93/93 runner+discovery+suite (5 suites)","typecheck":"clean","bench":"wall 4307 within noise of run 7 (4271); no regression"}}
{"run":9,"commit":"working","metric":0,"metrics":{"emit_context_ms":0.2,"emit_session_start_ms":42.4,"emit_session_shutdown_ms":13.8,"session_start_handlers":15,"session_shutdown_handlers":11,"context_handlers":2,"context_mutated":1},"status":"keep","description":"PI_TIMING=1 real turn measurement (pit -p ok) — first ground-truth of per-turn instrumentation","timestamp":1779263000000,"segment":0,"confidence":null,"asi":{"hypothesis":"baseline structuredClone in emitContext cost 5-20ms; serial emit() of session_start with 15 handlers cost ~45-60ms","ground_truth":{"emit_context_ms":0.2,"emit_session_start_ms":42.4,"emit_agent_start_ms":0.1,"emit_turn_start_ms":0.1,"emit_turn_end_ms":0.2,"emit_agent_end_ms":0.2,"emit_session_shutdown_ms":13.8},"interpretation":"emit_context_ms 0.2ms confirms structuredClone removal (was 5-20ms). session_start 42ms for 15 handlers = ~2.8ms avg — installed handlers are light; parallelization saves ms not hundreds. Real gain landed but bounded by handler weight","absent":"emit_bpr_ms not observed (provider call failed before fire — auth or model resolution); pi-claude-oauth-adapter is sole mutating bpr handler so future runs will show it serial single-handler","next":"add emit_*_ms to bench-startup synthetic harness with N=10 synthetic 50ms-sleep handlers to demonstrate parallelization win deterministically"}}
{"type":"config","name":"PiTuned harness quality: tool-call latency under load","metricName":"total_run_ms","metricUnit":"ms","bestDirection":"lower"}
{"run":10,"commit":"0f993d0","metric":104.056,"metrics":{"read_parallel_ms":0.89,"read_sequential_ms":2.425,"read_listener_overhead_ms":1053.318,"shell_parallel_ms":27.928,"shell_sequential_ms":72.812,"hook_parallel_ms":15.632,"hook_sequential_ms":157.503,"stream_no_listener_ms":0.758,"stream_with_listener_ms":188.674,"multi5_listener_ms":1080.679},"status":"keep","description":"baseline: bench-tool-calls-real after harness bringup. Validates agent-loop micro-opts (parallel, delta coalesce, Promise.all listeners) still work.","timestamp":1779408254788,"segment":2,"confidence":null,"asi":{"hypothesis":"post-bringup tool-call latency baseline. Confirms previously shipped micro-opts intact: parallel/sequential ratio 2.6-2.7x, hook parallel 10x faster, multi-listener ~ single-listener (Promise.all). Streaming coalesce 16ms cap works (188ms vs raw chunk count).","fanout":10,"runs_per_label":5,"warmup":2,"node_version":"tsx","validates":["parallel_tool_exec_2.7x","hook_parallel_10x","delta_coalesce_16ms_budget","multi_listener_promise_all"]}}
{"run":11,"commit":"d83acb6","metric":11627,"metrics":{"prompt_prefix_tokens":3142,"system_prompt_chars":3561,"tool_desc_chars":5005,"tool_param_chars":3061,"read_parallel_ms":0.89,"read_sequential_ms":2.425,"read_listener_overhead_ms":1053.318,"shell_parallel_ms":27.928,"shell_sequential_ms":72.812,"hook_parallel_ms":15.632,"hook_sequential_ms":157.503,"stream_no_listener_ms":0.758,"stream_with_listener_ms":188.674,"multi5_listener_ms":1080.679},"status":"keep","description":"prompt-size after F bullets added to read+edit descriptions. ~80 tok overhead total, recouped 1x on first avoided retry.","timestamp":1779408276700,"segment":2,"confidence":null,"asi":{"hypothesis":"F bullets added 5 lines to read.ts + 4 lines to edit.ts. Net ~+80 tokens in prefix. Single retry on a Sonnet costs ~500-2k tokens, so break-even at <10% retry reduction.","per_tool_chars":{"edit":1723,"bash":1349,"read":841,"write":501,"grep":221,"find":186,"ls":184},"ran":"tsx scripts/bench-prompt-size.mts"}}
{"run":12,"commit":"d83acb6","metric":1830,"metrics":{"sync_session_ms":1830,"sync_turn_ms":0.74,"queue_per_turn_session_ms":1828,"queue_per_turn_turn_ms":0.94,"queue_per_session_session_ms":1826,"queue_per_session_turn_ms":0.07,"persist_only_sync_ms":380,"persist_only_queue_turn_ms":378,"persist_only_queue_session_ms":376,"read_parallel_ms":0.89,"read_sequential_ms":2.425,"read_listener_overhead_ms":1053.318,"shell_parallel_ms":27.928,"shell_sequential_ms":72.812,"hook_parallel_ms":15.632,"hook_sequential_ms":157.503,"stream_no_listener_ms":0.758,"stream_with_listener_ms":188.674,"multi5_listener_ms":1080.679,"prompt_prefix_tokens":3142,"system_prompt_chars":3561,"tool_desc_chars":5005,"tool_param_chars":3061},"status":"discard","description":"REJECT persistence async-queue swap. Realistic bench (30 turns x 5 entries, 50ms idle) shows 1-4ms saved over full session, NOT 279x. Microbench was hot-path-only and misleading.","timestamp":1779408736333,"segment":2,"confidence":null,"asi":{"hypothesis":"scripts/bench-persistence.mts shows 279x async-queue vs sync. Implement queue in session-manager._persist for hot-path win.","test":"wrote scripts/bench-persistence-realistic.mts simulating 30 turns x 5 entries each, 50ms idle gap between turns; measured TOTAL wall (drain included), not hot-path","result":"sync 380ms persist-only over 30 turns (12.7ms/turn). Queue per-turn drain: 378ms (-2ms, 1.01x). Queue session-end drain: 376ms (-4ms, 1.01x). Per-turn turn-cost: sync 0.74ms, queue-drain 0.94ms (queue is SLOWER per turn due to promise machinery), queue-session 0.07ms (hot-path-only, deferred cost)","rollback_reason":"Microbench measured caller hot-path (0.03ms returns) but ignored that disk I/O still happens. Total wall identical because fsync dominates. Implementing async queue would add ~200 lines of crash-safety code (exit handlers, fork/branch drain, public flush API) for 4ms/session save = ~0.001% of session wall","next_action_hint":"Reject this lever entirely. Look at compaction LLM call (5-30s blocking) or extension session_start (42ms parallel sum, dominated by handler weight not orchestration)","lesson":"Hot-path microbench != real-world wall. Always measure end-to-end with realistic burst+idle pattern before chasing 100x+ microbench numbers","ran":"scripts/bench-persistence-realistic.mts (30 turns x 5 entries, 8 runs, 2 warmup)"}}
